{
  "$schema": "../../../core/library/piece.schema.json",
  "id": "star_power",
  "version": 1,
  "kind": "action",
  "category": "level",
  "name": "Star power",
  "description": "Grants Mario star invincibility ($1490). The timer runs down by 1 every 4 frames, so 255 lasts about 17 seconds. The star music is not started.",
  "author": "BlockCreator",
  "slots": "mario",
  "params": [
    {
      "name": "timer",
      "label": "Timer (1 = 4 frames)",
      "type": "number",
      "min": 1,
      "max": 255,
      "default": 255
    }
  ],
  "once": true,
  "clobbers": ["A"]
}
