{
  "$schema": "../../../core/library/piece.schema.json",
  "id": "c_random",
  "version": 1,
  "kind": "condition",
  "category": "conditions",
  "name": "Chance",
  "description": "True by chance. It asks the game's random number routine (GetRand, $01ACF9), which leaves its number in $148D, and is true when that number is below the chance. Every check draws a new number, so it is not the same result every frame.",
  "author": "BlockCreator",
  "slots": "any",
  "params": [
    {
      "name": "chance",
      "label": "Chance",
      "type": "enum",
      "options": [
        { "value": 192, "label": "3 in 4 (75 %)" },
        { "value": 171, "label": "2 in 3 (67 %)" },
        { "value": 128, "label": "1 in 2 (50 %)" },
        { "value": 85, "label": "1 in 3 (33 %)" },
        { "value": 64, "label": "1 in 4 (25 %)" },
        { "value": 51, "label": "1 in 5 (20 %)" },
        { "value": 32, "label": "1 in 8 (12 %)" },
        { "value": 26, "label": "1 in 10 (10 %)" },
        { "value": 16, "label": "1 in 16 (6 %)" },
        { "value": 13, "label": "1 in 20 (5 %)" },
        { "value": 8, "label": "1 in 32 (3 %)" },
        { "value": 3, "label": "1 in 100 (1 %)" }
      ],
      "default": 128
    }
  ],
  "clobbers": ["A"]
}
