{
  "$schema": "../../../core/library/piece.schema.json",
  "id": "create_smoke",
  "version": 1,
  "kind": "action",
  "category": "effects",
  "name": "Create smoke",
  "description": "Spawns a white smoke puff effect at the Block's position.",
  "author": "BlockCreator",
  "slots": "any",
  "params": [],
  "once": true,
  "clobbers": ["A", "X", "Y"]
}
